agent_id,author,subreddit,opinion_text,initial_belief,created_utc,parent_id,link_id,score
0,agent_0,politics,"Bro, you never know when ninjas\zombies\commies\charlies\democrats\Obamas might jump out to take your guns!",1,1554076924,t1_ejua8zg,t3_b7nkwp,2
1,agent_1,politics,So by extension you understand that removing the gun doesn't remove crime? It changes the tool a criminal uses to do bad things. Nothing more.,-2,1554076955,t1_eju9vfb,t3_b7o05v,0
2,agent_2,politics,"Speaking as an Irishman, this comment makes absolutely no sense. The reason we're an independent country and not part of the UK anymore is because a majority of our people voted for the pro-independence party back in 1918. The subsequent war of independence was fought because Britain refused to accept the result of that election. Ireland has never taken another country's territory by force without the consent of those living in it - the area covered by the Republic of Ireland was majority in favour of independence. That's partly why Northern Ireland exists, indeed - and the Irish government has never engaged in or supported any military campaigns to take it by force and claim it as part of our state.  If you believe that every country in the world has taken land by force and responded to the fact that a majority of the people opposed this action with ""tough shit, we have bigger guns so we can do whatever we like"", your world view is probably poisoned by the fact that America has indeed done this on several occasions. There are other countries out there which respect the concept of democracy and don't behave like prehistoric tribes.",0,1554077140,t1_ejsd3l6,t3_b7bcms,1
3,agent_3,politics,"&gt; I’m a well educated  well-educated (unless your education was in hydrology or aquatic drilling).  And the notion that every must be allowed access to firearms because ""defense"" is patently absurd. Should the schizophrenic who sees demons and hears voices from god telling him to cleanse the world have access? How about the guy who has been charged and convicted of multiple domestic violence counts? Should he have access? How about the man who, right now, is seething with hatred toward (insert hate target here) because his head has been pumped full of lies about how they are somehow out to destroy the world?   Anyone who says that ""guns are made for protection, simple as that"" is being dishonest.",2,1554077174,t1_eju38ts,t3_b7skx2,-2
4,agent_4,politics,Some* people.    But those of us who have encountered people high on drugs with guns think otherwise.,1,1554077339,t1_ejt739f,t3_b79598,0
5,agent_5,politics,"You gave your reason for being anti-abortion, I gave you another country's stance on the issue as a point of comparison. As to your assertion about Australian gun laws, these statistics seem to contradict you.   https://www.factcheck.org/2017/10/gun-control-australia-updated/",0,1554077380,t1_ejua9cy,t3_b7oqf5,2
6,agent_6,politics,"&gt;Ruin Libya that was underneath a brutal murderous dictator? Anyways, Libya's intervention was mainly France baby they wanted to intervene and lobbied America hard. Look how long it took for us to step in. We waited until all the rebels and the entire city of Benghazi was about to be wiped out. Gaddafi was about to murder the entire freaking city. You bring up the Manchester bomber that was freaking born in the UK!?!?!?! Funny enough his parents fled Libya because Gaddafi was about to murder them  [Hilary’s own words](https://wikileaks.org/clinton-emails/emailid/23898)  [We came we saw he died.](https://m.youtube.com/watch?v=mlz3-OzcExI)  Brought back [the slave trade to Africa...](https://m.youtube.com/watch?v=2S2qtGisT34)  &gt;Syria would have been a shitshow no matter if we ran guns there or not because other Shia countries in the Middle East would have done the same thing. Russia and Iran propping up Assad is causing most of the strife there.  Wrong.  [Operation Timber Sycamore](https://en.m.wikipedia.org/wiki/Timber_Sycamore)  [Gun running from Libya to Syria](https://www.nytimes.com/2013/06/22/world/africa/in-a-turnabout-syria-rebels-get-libyan-weapons.html)   And as to automation being the cause and not NAFTA...  The passage of NAFTA led to even more investments by auto companies, who installed more advanced equipment and technology so that the Mexican plants would match those in Canada and the United States  According to Forbes, about 80 percent of the cars manufactured in Mexico are exported globally, with about two-thirds of those exports going to the United States. In 2014, the industry comprised about $19 billion in investments. Production for that year was estimated to reach 3.2 million cars, double what it had been five years prior.  [Source](https://napsintl.com/automotive-manufacturing/mexicos-auto-industry/)   It wasn’t “automation” IT WAS NAFTA  You know why it’s so easy for me to back up my claims? Because I’m telling the truth.",0,1554077543,t1_eju8lgq,t3_b7sycp,4
7,agent_7,politics,"Honestly the NRA is self interest, not even pro 2A. They may fight every curtailing of gun rights, but as in the case of the black man shot while legally carrying and complying with the  officer in Minnesota, if it makes them look bad to their donors they'd do anything to avoid it.  Makes me wonder why more startup organizations aren't about doing the right thing and allowing people to reward them for it, I don't know the business model of things like Khan Academy, Wikipedia, NPR, and PBS, but these guys are still around despite the government trying to quash the later two every other week.  A gun organization that promotes gun safety and the right mindset while providing hunters and DGU types honest reviews and feedback on guns, hunting spots and tips for the hunting types, de-escalation advice while avoiding the shrill political clickbait of the NRA, leaving their coverage to putting proposals into layman's terms... Who wouldn't want that.",1,1554077679,t3_b7i61m,t3_b7i61m,1
8,agent_8,politics,"Taking away gun rights, taking even more hard earned dollars, redistribution, seizing control of health care... And I'm sorry how exactly is trump an authoritarian? Reducing taxes? Reducing government programs? Reducing government control over the internet? Reducing gun laws? Ordering the troops out of the middle East? Engaging in peaceful negotiations?   Seriously, you need to brush up on the definition ""authoritarianism""",-2,1554077828,t1_ejtua9a,t3_b7o2l5,-2
9,agent_9,politics,Here’s one to back up my claim. [support](https://www.google.com/url?sa=i&amp;source=web&amp;cd=&amp;ved=2ahUKEwiA2drXzq3hAhUBXawKHdqwBU8QzPwBegQIARAC&amp;url=https%3A%2F%2Fwinteryknight.com%2F2017%2F10%2F06%2Fdid-australias-ban-on-guns-lower-violent-crime-rates-and-lower-suicide-rates-2%2F&amp;psig=AOvVaw14JW1VuEBXbGpW8NNweShO&amp;ust=1554164128562678),0,1554077834,t1_ejubak5,t3_b7oqf5,0
10,agent_10,politics,"1. $419 Million was there total operating expenses for 2016.  About $30 Million of that was spent on the Presidential Election. 2. The NRA receieved a little over $2,500 in membership dues from Russian Addresses.  Thats a long way from $30 Million.",0,1554077853,t1_eju9zpa,t3_b7tgwl,2
11,agent_11,politics,He was in Kabul and routinely rode shotgun (literally) in convoys outside the wire. He wasn't infantry but he absolutely did a combat tour.,0,1554078044,t1_eju9mx8,t3_b7sclu,11
12,agent_12,politics,"You say that, but he's been tweeting and saying at rallies that the people with guns and bullets are on his side... What kind of message is that sending? He is basically calling for a new civil war.",1,1554078076,t1_ejtyvl9,t3_b7sa1t,3
13,agent_13,politics,I was cleared of littering when I threw that gun in the bushes after I killed a guy. I'm obviously innocent.,0,1554078241,t1_ejt5jny,t3_b7nzca,1
14,agent_14,politics,"Plenty of legal gun owners kill themselves with their own guns, accidentally or on purpose, all the time. Plenty of legal gun owners also accidentally kill or maim other people in, you know, gun accidents. Plenty of children of legal guns owners die in accidents like that too.   The suggestion that the *majority* of people killed by guns in arguments, domestic disputes, and road rage incidents are done by illegal gun owners is laughable. There’s plenty of shitty, irresponsible, yet “legal” gun owners out there simply because it’s so easy to legally acquire a gun. Hence the desire for regulations.",2,1554078451,t1_eju79fm,t3_b7oqf5,1
15,agent_15,politics,Establishment Elite: Fire your gun while your powder is wet! We like our tax cuts.,0,1554078531,t3_b7rery,t3_b7rery,-3
16,agent_16,politics,"Wow, I didn't know a SoS was basically god emperor. She advises the President on foreign affairs but ultimately it was still Obama. I didn't know a multi-prong effort by NATO with a bunch of other countries= all Clinton's fault. You trying to shoehorn the Libyan manchester bombing also shows your disingenuous argment.   https://mg.co.za/article/2011-03-08-uk-france-spearhead-drive-for-libya-nofly-zone  I never said we didn't run guns into Syria I said if we didn't then other Middle East country would have done the same.  Hmmm I didn't know the auto industry =  all of our manufacturing output. I must have never been informed of that...  https://www.pewresearch.org/fact-tank/2017/07/25/most-americans-unaware-that-as-u-s-manufacturing-jobs-have-disappeared-output-has-grown/",0,1554078939,t1_ejubhps,t3_b7sycp,1
17,agent_17,politics,So culture can have more of an impact on suicide rates than guns? Because that is my point.,-1,1554079119,t1_ejubhd6,t3_b7jnwb,1
18,agent_18,politics,"&gt;The NRA is to gun safety what oil companies are to ending climate change  I'm responding to this. Don't move the goalposts because you're wrong. And I'll state clearly, that I have no love for the NRA. There are as many good reasons to shit on the NRA as we can think of, but saying what you said that I quoted here is demonstrably incorrect.",2,1554079181,t1_ejtu56b,t3_b74abu,1
19,agent_19,politics,In NC Democrats lost seats because Republicans got amendments put on the ballot like marriage is only between a man and a women.  The may have been a gun amendment also on the ballot.  That gave the Republicans big reasons to turn out.  The other big reason was it was a midterm election and since they had done so well in 2008 they did not need to show up to vote in 2010.,0,1554079617,t1_ejudcxt,t3_b7pihp,1
20,agent_20,politics,"Bernie Sanders is a Washington insider, sandbagged on common sense gun control, shit on Hillary Clinton for no good reason, his supporters polarized the left with his claims of low information voters, Vagina voters, and shrills, and he seemed to have the weight of the Republican Party and Russians behind him.",1,1554079619,t1_eju5muc,t3_b7sycp,2
21,agent_21,politics,"Marching is all you have. Look Mitch McConnell marched too, but I don't see anybody calling him a civil rights icon. He voted for the crime bill, ignored concerns of black leaders in Vermont, talks about how guns in Chicago are different than guns in Vermont. He excused voters who might be afraid of voting for a black man in a post-Obama world, talking about a state that he won twice.",0,1554079665,t1_ejsu7uj,t3_b7glgt,1
22,agent_22,politics,"Well, the invasion scenarios are all myths, so there's that. Picking the most realistic myth doesn't really help anyone. Better chance your going to blast a family member wondering what the fuck is going on than to actually have an armed intruder in your house. And if you're armed and trained appropriately you should be moving to identify and neutralize your target. Or just yell, ""I have a gun"". Whether or not you have one chances are they leave. Probably didn't mean to break in with you home in the first place.  The entire ""armed home invader"" fairy tale is a ridiculous joke perpetrated by the NRA to give idiots who want an excuse to imagine themselves as heroic badasses. Oh, and push them to get firepower they don't need. And accessories for said weaponry...  And queue some anecdotal story about a home invasion is some area that happened once...",2,1554080497,t1_ejuda4v,t3_b7jnwb,1
23,agent_23,politics,"Oh Trump was indicted on Obstruction of Justice charges?  Must have missed that scandalous event.  Again, how can someone not charged with a crime be exonerated?  As I said, someone who is wrongfully convicted of a crime and is then found to be innocent, that's considered exoneration.  Someone who's been charged with a crime, and found not guilty, that person has been exonerated.  A person not charged with a crime can not be exonerated because the underlying premise of an exoenration is a CRIME.  Actually Barr quoted Mueller in saying that no underlying crime was committed.  &gt;The Special Counsel's investigation did not find that the Trump campaign or anyone associated with it conspired or coordinated with Russia in its efforts to influence the 2016 U.S. presidential election. As the report states: **“The investigation did not establish that members of the Trump Campaign conspired or coordinated with the Russian government in its election interference activities.**  &gt;In making this determination, we noted that the Special Counsel recognized that **“the evidence does not establish that the President was involved in an underlying crime related to Russian election interference,""** and that, while not determinative, the absence of such evidence bears upon the President's intent with respect to obstruction.  If Barr was lying, why hasn't Mueller or anyone from his team disputed the summary?  Mueller had 18 prosecutors and 40+ federal agents, not one of them, including Mueller himself, has disputed Barr's summary.",0,1554080577,t1_ejue0mh,t3_b7nkwp,-1
24,agent_24,politics,"DC vs Heller extends Second Amendment rights as both individual rights (not exclusive to a “militia”, in the National Guard sense) and extends them to arms in common use.  The shit that Democrats keep trying to roundabout ban are near always fit the bill for being in common use.",-2,1554081425,t1_eju5mef,t3_b7szg4,12
25,agent_25,politics,Funny how the NRA was silent on that one.,1,1554081639,t1_eju7olw,t3_b7sej2,2
26,agent_26,politics,"No, your lying.   She had very detailed policy positions which where very good. For every one minute the media spent discussing them they spent nine minutes talking about emails, not an exaggeration. Trump got over a Billion dollars of free air time having his speeches aired from beginning to end, Hillary never got that.   When Comey announced a week before the election he was starting a new investigation, every talking head on Fox said this opened the election up for Trump, he has a shot now is what they said. After the election they all denied it had any impact.  Yet again, you are forgetting the tens, maybe hundreds of million of dollars Russia spent to get Trump elected. Money spent illegally hacking, paying for adds no one could associate themselves with and probably illegally funneled to the candidate (NRA).   &amp;#x200B;",0,1554081782,t1_ejuee56,t3_b7sycp,19
27,agent_27,politics,"First, you ban the bump stocks then you fill the first with judges that believe in the second amendment. They rule it unconditional and all is well. Genius",1,1554081866,t3_b7vc06,t3_b7vc06,-12
28,agent_28,politics,"The article focuses on Iowa, so *rural* means *farming*, in particular grain farming and meat animals. Meat is problematic, but grain farming would seen to be a losing business for family farms since there's not a lot of differentiation between different farms using the same seeds and same fertilizers. Relying on commodity crops sure seems to be a losing proposition, and it's unclear there's anything other than crude subsidization that either party could do to help farmers.  As for floods, to the extent they're related to climate change, meat animal husbandry is likely to be in direct opposition to mitigating or reversing climate change. The awful truth may just be that sheep raising in Nevada may be far more sustainable than cattle or hog raising in Iowa.  More generally, *rural* can mean timber harvesting, mining and other forms of mineral extraction, tourism, and other things not related to farming. However, those rural areas are places where there's likely to be a lot more hunting than cities, suburbs and farmland, meaning guns matter A LOT to many of the people who live there. I can't see how Democrats improve their appeal in that kind of rural American without learning to distinguish hunting guns from pistols and military-style rifles.  But that leaves what may be the whale in the swimming pool: abortion. To the extent rural areas, farmland or wildland, have people more inclined to oppose abortion rights, it may be impossible for Democrats to make much gains without allowing for heterodoxy about the issue.",0,1554081927,t3_b7vbri,t3_b7vbri,1
29,agent_29,politics,"It’s a hit job being spammed all over the place by Biden’s enemies, ie, primarily Bernie bros and the right.   Frankly, politically I don’t care. I don’t want Biden anyway, and don’t think he stands a chance in the primaries. And I’d hate to see his character savaged.   I’m more concerned about a candidate like Sanders, his deeply troubling cock sucking of the gun lobby, and his problems getting the kind of support from minorities any Democrat would need to win.",0,1554082064,t1_ejugebj,t3_b7vd8g,0
30,agent_30,politics,Bernie has a D- rating with the NRA and polls better with minority voter than white voters. No need for homophobia.,1,1554082151,t1_ejugpxe,t3_b7vd8g,1
31,agent_31,politics,Welcome to the Y'all Quadea. Complete theocratic control.  They will ban guns because they're afraid of an armed populace. Their Evangelical supporters will be outnumbered and outgunned.,-2,1554082348,t1_ejughuf,t3_b7vc06,6
32,agent_32,politics,"I'm one of these felons, does this relate to fines and restitution or parole fees stemming from the convictions? Restitution is technically part of your sentence, are court fees also considered that?. Though I dont think they should ever had their voting rights taken away, but what kind of charges come with fines/court fees in the hundreds of thousands? Hopefully we can reach the ones that are allowed and get them to vote. This will be the first time I've had the right to vote and I hope it can make a difference.  I personally stole a firearm that ended up being used in a non-fatal shooting. I only ended up maybe with a few thousand in fines and restitution and served 2 years with another 2 on parole. I also had to pay 800 in restitution stemming from the actual theft. I don't remember paying much court fees though, but my charge was in 2008.",0,1554082971,t1_eju5wew,t3_b7tup6,60
33,agent_33,politics,They can subpoena the report and Barr can and will ignore it. He doesn't even need to bring Trump into it. It's simply not up to Congress when the report is released. It's also not up to Congress what gets redacted.   The DEM house doesn't even think they are going too get the report even one day before Barr decides its ready. It's all political theater ment to keep their base thinking there is still the possibility of a smoking gun.,0,1554083054,t1_eju8jl6,t3_b7ogec,-1
34,agent_34,politics,"&gt; To attribute Dems’ success entirely to progressives  you're misunderstanding me. i didnt mean to say progressives single handedly won dems 2018, but that they only merely begun come out in force in 2018.  the original assertion was that progressives would be a political liability a la the tea party, which i thought was rich considering dems were already racking up catastrophic defeats under the leadership of these same people making these assertions and keeping progressives from power.",0,1554083150,t1_ejufvkh,t3_b7r0a7,5
35,agent_35,politics,Russia and the NRA filled the gap in Trump’s spending.,1,1554083357,t1_ejug6kp,t3_b7rfw8,13
36,agent_36,politics,"His taxes ARE THE SMOKING GUN. Congrats America, we have elected a criminal",0,1554083638,t1_ejtx87c,t3_b7sa1t,2
37,agent_37,politics,I’ll point out at least 10 different issues they could be focused on instead of putting their 2 cents in on US gun laws.,-1,1554083663,t1_ejuczc6,t3_b7szg4,4
38,agent_38,politics,"&gt;If history foretells, the gun-rights bills will have a better chance at success. In the years since Sandy Hook, when 26 were slain in 2012, states have enacted nearly 600 new gun laws, according to data compiled separately by the National Rifle Association and the Giffords Law Center to Reduce Gun Violence.  &gt;*Nearly two-thirds of those were backed by the NRA.*  https://www.pbs.org/newshour/politics/nra-has-backed-most-state-gun-laws-passed-since-sandy-hook",-1,1554083687,t1_ejs88tj,t3_b7i61m,1
39,agent_39,politics,"No they aren't less human, they fled their country illegally though. Why not come in legally? And I will admit our immigration system needs to be faster, but really, it's not impossible to get in the country. If those immigrants have clean background checks, they can come in. If they don't, they should be deported. We dont need criminals in our country.",0,1554084089,t1_ejs5r19,t3_b7b4js,0
40,agent_40,politics,"He does say that, and there are certainly a lot of gun-toters out there who *do* support him, but I've got to believe that the military, Secret Service, National Guard, FBI, etc., would be on the side of the law.  The backwoods militiamen are great at defending their own compounds in Montana, but I don't know how far they'd get if they actually tried to take over the White House grounds to ""protect"" their favorite grifter once he's no longer legally President.",0,1554084199,t1_ejuc4ln,t3_b7sa1t,1
41,agent_41,politics,"Look, you can support some baby killer who wants to send the gestapo in to take everyone's God Bequeathed Guns, or you can vote Trump.",-2,1554084312,t1_ejtyztv,t3_b7sa1t,1
42,agent_42,politics,"When discussing the two halves, it is perfectly plausible and not exclusive that of the two halves, there are individuals that are both. That is a logical possibility. Mathematically it is possible and nothing I said is exclusive of it.   You just jumped the gun trying to be an asshole, and have too much pride to admit that you couldn't even be pedantic correctly.",0,1554084645,t1_ejuhxj9,t3_b7sycp,2
43,agent_43,politics,"&gt;  Bernie Sanders is a Washington insider, sandbagged on common sense gun control, shit on Hillary Clinton for no good reason, his supporters polarized the left with his claims of low information voters, Vagina voters, and shrills, and he seemed to have the weight of the Republican Party and Russians behind him.  This is such bullshit. Go peddle it elsewhere. Self branded socialists don't get to be Washington insiders, for starters. He didn't sandbag gun control, shit on Hillary at all **and ultimately camapigned _with_ her  in spite of jeers from his most myopic supporters.** I heard FAR more Hillary supporters hurling the ""low information voter"" line, never once heard any of them call them ""vagina voters"" though there was definitely sexism coming from Hillary supporters. Her fucking campaign posters isolated **her** sex, and no one called them ""shrills"" they did call them shills because PACs such as Correct the Record were openly investing in social media opinion shaping. Republicans were not focused on him at all. Russia might've been spoiling the fight, but it's not like he fucking coordinated with the Russians to benefit from their team chaos bullshit. She did the same fucking thing to Obama that she did to Bernie and it was old the first time. You need to quit with the lies.  Also, the surgical accuracy of their vote brigading to this day is still obvious because they're just as bitter and one-dimensional as Trump supporters. You're not selling me on someone who was voted one of the least liked general election candidates of all time, right behind the guy who fucking won. Bernie was polling way higher than Trump. Was that Russians?  Playing madlibs with my comment doesn't show any awareness on your part. It just shows you want a lazy no-brainer paint-by-numbers response.",1,1554084878,t1_ejudwwi,t3_b7sycp,-3
44,agent_44,politics,"The difference is, is that there's proof of the republicans being criminals. They all take money from the NRA, and the NRA was receiving money from Russia.  The ad person for the NRA was talking to specific PACs and campaigns to coordinate their messages.  That's all illegal, full stop.  They all should be RICO'd in a just world.",1,1554085287,t1_ejucp35,t3_b7rdjp,12
45,agent_45,politics,"Here's a recent case I remember - click save - 90 year old empties gun into intruder, both survive. Intruder sues homeowner that he shot while robbing his home: [https://www.cbsnews.com/news/burglar-sues-calif-homeowner-90-who-returned-fire/](https://www.cbsnews.com/news/burglar-sues-calif-homeowner-90-who-returned-fire/)",-2,1554085358,t1_eju5bax,t3_b7szg4,2
46,agent_46,politics,All this gun violence I wish someone would direct their rage at this fella here.  I'm too much of a chicken and probably would shoot myself instead but yeah.  Come on people lets make the most gun deaths count for something sheesh  All these rightwing massacres....,1,1554085629,t3_b7rfw8,t3_b7rfw8,-4
47,agent_47,politics,All they care about is pot and muh guns.,1,1554086803,t1_ejttcdv,t3_b7qsj5,3
48,agent_48,politics,"What's with the one-hunded gun shooting with his hand in his pocket? Looks like he has some kind of crazy grip, is this a sport or something?",0,1554086956,t3_b7wcgn,t3_b7wcgn,1
